{
  "$schema": "./profile.schema.json",
  "schemaVersion": 1,
  "name": "winenv-runtime",
  "defaultProfiles": [
    "runtime"
  ],
  "scoopBuckets": [],
  "packages": [
    {
      "key": "powershell",
      "displayName": "PowerShell 7",
      "owner": "winget",
      "id": "Microsoft.PowerShell",
      "source": "winget",
      "profiles": ["runtime"],
      "commands": ["pwsh"]
    },
    {
      "key": "fzf",
      "displayName": "fzf",
      "owner": "winget",
      "id": "junegunn.fzf",
      "source": "winget",
      "profiles": ["runtime"],
      "commands": ["fzf"]
    }
  ]
}
